plan_step_id,canonical_sdu_agent,operational_agent,phase,purpose,search_scope,selection_criteria,input_artifact,output_artifact,gate_required,validator,next_step,status,stop_condition
SSP001,seshat-normativa,court.seshat_evidence,SEARCH,Collect sanctioned evidence for search and selection,repo-scoped evidence package only,evidence is sanitized versioned and linked to PR 101,.agents/codex/matrices/AGENTS_SDK_LIVE_AGENT_GLOBAL_OPERABILITY_FINDINGS_20260605.csv,.agents/codex/readbacks/2026-06-05_agents_sdk_live_agent_global_operability_readback.md,none,.agents/codex/tools/local_validate_agent_layer.ps1,SSP002,ACTIVE,readback_missing
SSP002,thot-tecnico,court.thot_schema,SEARCH,Normalize searchable fields for decisions RACI workflow and org chart,matrices maps readback in PR 101,artifact has schema owner validator and stop condition,.agents/codex/matrices/AGENTS_SDK_LIVE_AGENT_GLOBAL_OPERABILITY_REVIEW_EVALUATION_DECISION_WORKFLOW_20260605.csv,.agents/codex/matrices/AGENTS_SDK_LIVE_AGENT_GLOBAL_OPERABILITY_SDU_SEARCH_SELECTION_PLAN_20260605.csv,none,.agents/codex/tools/local_validate_agent_layer.ps1,SSP003,ACTIVE,validator_failed_actionable
SSP003,horus-riesgo,rey.frontier_guardian,EVALUATE,Filter out risky or gated candidates before selection,decision matrix and RACI rows,candidate does not require live cost production secret permission tenant or clone movement,.agents/codex/matrices/AGENTS_SDK_LIVE_AGENT_GLOBAL_OPERABILITY_DECISION_MATRIX_20260605.csv,.agents/codex/matrices/AGENTS_SDK_LIVE_AGENT_GLOBAL_OPERABILITY_SDU_SEARCH_SELECTION_PLAN_20260605.csv,conditional,.agents/codex/tools/local_validate_capability_use_hardening.ps1,SSP004,ACTIVE,blocked_surface_detected
SSP004,anubis-gate,rey.frontier_guardian,EVALUATE,Assign gate rollback postcheck and stop condition to selectable candidates,workflow org chart and decision matrix,candidate has explicit gate none or named gate plus rollback and postcheck,.agents/codex/matrices/AGENTS_SDK_LIVE_AGENT_GLOBAL_OPERABILITY_ORG_CHART_20260605.csv,.agents/codex/matrices/AGENTS_SDK_LIVE_AGENT_GLOBAL_OPERABILITY_SDU_SEARCH_SELECTION_PLAN_20260605.csv,conditional,.agents/codex/tools/local_validate_order_packets.ps1,SSP005,ACTIVE,gate_missing
SSP005,maat-cumplimiento,court.sdu_gate,SELECT,Select next executable local-only decisions,decision matrix and RACI rows,decision is EXECUTE_ON_NEXT_LANE and has accountable responsible validator and disjoint scope,.agents/codex/matrices/AGENTS_SDK_LIVE_AGENT_GLOBAL_OPERABILITY_RACI_MATRIX_20260605.csv,.agents/codex/matrices/AGENTS_SDK_LIVE_AGENT_GLOBAL_OPERABILITY_SDU_SEARCH_SELECTION_PLAN_20260605.csv,none,.agents/codex/tools/local_validate_parallel_order_governance.ps1,SSP006,ACTIVE,lane_scope_overlap
SSP006,anubis-gate,rey.frontier_guardian,SELECT,Separate non-executable gated decisions for human gate queue,decision matrix,decision is KEEP_GATED REQUIRE_LIVE_GATE REQUIRE_HUMAN_GATE REQUIRE_WORKTREE_GATE or SERIALIZE,.agents/codex/matrices/AGENTS_SDK_LIVE_AGENT_GLOBAL_OPERABILITY_DECISION_MATRIX_20260605.csv,.agents/codex/matrices/AGENTS_SDK_LIVE_AGENT_GLOBAL_OPERABILITY_SDU_SEARCH_SELECTION_PLAN_20260605.csv,yes,.agents/codex/tools/local_validate_order_packets.ps1,SSP007,ACTIVE,human_gate_required_for_ready_or_merge
SSP007,thot-tecnico,court.thot_schema,PACKAGE,Build next-lane candidate set with exact files validators rollback and stop condition,selected local-only rows from SSP005,candidate set is versionable repo-scoped and validator-covered,.agents/codex/matrices/AGENTS_SDK_LIVE_AGENT_GLOBAL_OPERABILITY_SDU_SEARCH_SELECTION_PLAN_20260605.csv,.agents/codex/matrices/PARALLEL_OPERATION_CRITERIA_MATRIX.csv,none,.agents/codex/tools/local_validate_parallel_order_governance.ps1,SSP008,ACTIVE,parallel_lane_without_validator
SSP008,narrador-normativo,court.seshat_evidence,EVIDENCE,Narrate only approved evidence and selection result after validation,validated search selection plan,readback states what was selected not selected and why,.agents/codex/matrices/AGENTS_SDK_LIVE_AGENT_GLOBAL_OPERABILITY_SDU_SEARCH_SELECTION_PLAN_20260605.csv,.agents/codex/readbacks/2026-06-05_agents_sdk_live_agent_global_operability_readback.md,none,.agents/codex/tools/local_validate_agents_instruction_hierarchy.ps1,SSP009,ACTIVE,approved_evidence_missing
SSP009,seshat-normativa,court.seshat_evidence,STOP,Close search selection planning at PR review,PR 101 evidence package,PR remains draft until human approval for ready or merge precheck,.agents/codex/readbacks/2026-06-05_agents_sdk_live_agent_global_operability_readback.md,PR_101_REVIEW_READY,yes,.agents/codex/tools/local_validate_capability_use_hardening.ps1,END,ACTIVE,human_gate_required_for_ready_or_merge
