check_id,component,status,evidence,risk,gate,next_action,validator,stop_condition
codeql.health.version,CodeQL CLI version,PASS,"CodeQL command-line toolchain release 2.25.6 from C:\Users\enzo1\AppData\Roaming\Code - Insiders\User\globalStorage\github.vscode-codeql\distribution4\codeql\codeql.exe",low,none,"keep CodeQL as local analysis helper for nuestra cabina","codeql version",EXECUTED_LOCAL_VALIDATED
codeql.health.languages,CodeQL visible languages,PASS,"codeql resolve languages exited 0; evidence in C:\Users\enzo1\CodexLocal\OPTIMIZACION_PC\vscode-insiders-our-cabina-refresh-20260606-004455\codeql-resolve-languages.txt",low,none,"use language availability as local-only capability evidence","codeql resolve languages",EXECUTED_LOCAL_VALIDATED
codeql.health.global_storage,CodeQL globalStorage,OBSERVED,"github.vscode-codeql globalStorage exists; about 637.97 MB and 3270 files",medium,GATE_DESTRUCTIVE_ACTION,"do not delete CodeQL globalStorage while language/query servers are active; review only if cleanup gate opens","codeql-local-health-summary.json",PENDING_APPROVAL_ONLY
codeql.health.processes,CodeQL active processes,OBSERVED,"8 CodeQL-related processes detected: 2 cli_server, 4 language_server, 2 query_server_current_workspace_possible",medium,GATE_DESTRUCTIVE_ACTION,"do not terminate CodeQL processes without explicit process gate and unsaved-work check","codeql-processes-sanitized.csv",PENDING_APPROVAL_ONLY
codeql.health.current_workspace_link,CodeQL linked to nuestra cabina,VERIFIED,"3 CodeQL-related processes reference workspaceStorage 42ad9d6456c5eea9a87526fe3c7584d5 for cabina-universal-d",low,none,"treat CodeQL local health as active for current cabina","codeql-processes-sanitized.csv",EXECUTED_LOCAL_VALIDATED
codeql.health.workspace_storage,Our cabina workspaceStorage,VERIFIED,"workspaceStorage 42ad9d6456c5eea9a87526fe3c7584d5 exists; about 0.82 MB; CodeQL workspace subdir exists; structured evaluator log exists",low,GATE_DESTRUCTIVE_ACTION,"preserve current workspaceStorage; no cleanup needed for our cabina","codeql-local-health-summary.json",EXECUTED_LOCAL_VALIDATED
codeql.health.side_effect_boundary,Side effects,VERIFIED,"Codex executed only local CodeQL version and resolve languages; no files deleted, no processes closed, no settings touched, no external network called by Codex",low,none,"next safe lane can be OpenAI/Codex local app-server boundary or CodeQL repo query dry-run if desired","codeql-local-health-summary.json",EXECUTED_LOCAL_VALIDATED
