"wave_id","agente_owner","agente_reviewer","surface","read_scope","write_scope","lock_key","estado_esperado","evidencia","validador","rollback","stop_condition","next_delta"
"W0_PREFLIGHT_MESA","Narrador","Maat","PROJEC CDX","operativa; inventarios; hitos; dataverse; git status local","plan; matriz; readback; hito","plan-maestro-20260617","PLAN_PREPARADO_VERSIONABLE","operativa/PLAN_MAESTRO_ATOMICO_TENANT_DATAVERSE_CODEX_CLOUD_20260617.md","git diff --check; tools/validate_proj_cdx_workbench.ps1","retirar paquete plan e indice","plan_without_validator","delta_repo_dirty_worktree_triage_by_surface"
"W1_REPOS_DIRTY_TRIAGE","Ramanujan","Anubis","Documents/GitHub repos dirty","git status; git diff --stat; git diff --name-status","none during scouting","repo-dirty-triage-by-surface","OBSERVED_READ_ONLY","matriz de diffs por repo","git status --short --branch por repo","no aplica en scouting","repo_diff_unclassified","package_dirty_repos_by_surface"
"W2_MAPAS_MINIMOS","Seshat","Thot","repos sin MAPA.md","README; AGENTS; estructura raiz","MAPA.md solo si aporta navegacion real","repo-map-minimal-canon","DELTA_APLICADO_OR_NO_OP_LISTO","decision por repo map_required/map_deferred","git diff --check","remover mapa creado o volver a README+AGENTS","map_would_duplicate_readme","apply_minimal_maps_after_diff_classification"
"W3_CARPETAS_NO_REPO","Thot","Horus","Auditar; cdf_gate68_solution_clone","metadatos locales; manifiestos; origen probable","none until owner decision","nongit-folder-classification","OBSERVED_READ_ONLY","clasificacion archive/promote/keep/move","existencia y ruta absoluta","comando inverso si se mueve","folder_identity_ambiguous","decide_non_git_folder_destination"
"W4_DATAVERSE_METADATA","Faraday","Anubis","Dataverse HUBDesarrollo","readbacks; manifests; matrices; inventory","paquetes locales dataverse/operativa/hitos; live solo con orden","dataverse-metadata-hydration","METADATA_ONLY_PREPARED","manifest YAML; matriz CSV; readback","validate_sdu_dataverse_metadata_wave or candidate_count=1","reemplazo por canonical_id bajo orden humana","candidate_count_not_one","prepare_hydration_batch_by_canonical_id"
"W5_TENANT_POWER_PLATFORM","Horus","Maat","Tenant Escribania Bitsch","summaries saneados; conteos; ids entorno; colas; soluciones","readback local only","tenant-readback-no-payload","OBSERVED_READ_ONLY","conteos ids URLs sin payload sensible","tenant_id match 858a0852-44a1-413e-a0fe-f053949797d6","retirar readback si tenant mismatch","tenant_mismatch","refresh_tenant_counts_without_payload"
"W6_CODEX_CLOUD_RUNNER","Faraday","Thot","Codex Cloud PROJEC CDX","branch remota; setup cloud; smoke task; bridge","prompts/readbacks locales; task cloud solo con gate","codex-cloud-runner-smoke","READY_FOR_CODEX_CLOUD_UI","smoke; cloud-bridge; agentic-cloud-bridge","python -m projec_cdx_cloud --smoke; --cloud-bridge","revert runner; reset cache cloud si ruta vieja","cloud_workspace_path_windows","run_cloud_smoke_task_and_capture_result"
"W7_SKILLS_RECIPES_TOOLS","Seshat","Narrador","recipes; procesos; patrones; tools; indices","skills usadas; readbacks; validators","canon reusable local","canon-recipe-skill-sync","DELTA_APLICADO","matriz skill/recipe/tool/patron","git diff --check","retirar archivo o entrada indice","knowledge_left_only_in_chat","promote_stable_patterns_to_skills"
"W8_HITOS_SEMAFORO","Narrador","Maat","hitos; TRACE; NEXT","paquetes generados; validators; git status","hitos; indices; trace; next","hito-closeout-atomic","DELTA_APLICADO_OR_EN_ESPERA_DE_CIERRE","README; MANIFEST; INDICE; READBACK; EVIDENCIA","tools/validate_proj_cdx_workbench.ps1","retirar hito e indice","evidence_missing","close_each_wave_with_readback"
