gate_id,target_version,surface,repo_or_system,objective,current_status,required_owner_decision,required_inputs,rollback_required,postcheck_required,evidence_required,blocked_by,recommended_order,decision
GATE_0.2.0_DATAVERSE_RUNTIME_ACTION_7_OWNER_CLASSIFICATION,0.2.0,dataverse,cabina-universal-d / Dataverse runtime registry,Clasificar septimo runtime action,BLOCKED_WITH_GATE_PACKET,si,"owner classification; target row identity; allowed action; no-secret evidence",si,si,si,owner classification missing,1,NO_EXECUTE_LOCAL_ONLY_PACKET
GATE_0.2.1_CHANGE_AWARE_EVIDENCE_CABINA_SYNC,0.2.1,github/cabina-universal-d,cabina-universal-d,Sincronizar o regenerar evidencia change-aware en repo origen,BLOCKED_WITH_GATE_PACKET,si,"repo target; source artifact; expected commit; regeneration command if present",si,si,si,external repo lane,2,NO_PUSH_NO_PR
GATE_0.2.2_PR130_CONSTITUTION_SYNC_CABINA,0.2.2,github/cabina-universal-d,cabina-universal-d,Resolver drift entre MANIFEST y constitucion PR130,BLOCKED_WITH_GATE_PACKET,si,"PR130 source evidence; manifest; constitution; owner decision",si,si,si,external repo canon lane,3,NO_PUSH_NO_PR
GATE_0.2.3_GITHUB_LABELS_DEPENDABOT_PROJEC_CDX,0.2.3,github,universo-rey/projec-cdx,Crear o corregir labels requeridos por Dependabot,BLOCKED_WITH_GATE_PACKET,si,"label list; repository owner; GitHub write permission",si,si,si,GitHub write gate missing,4,REQUIRES_GITHUB_WRITE_GATE
GATE_0.2.4_SDU_CN_ISSUE_PREP_REMOTE_ALIGNMENT,0.2.4,github,SeshatSgin/seshat-bootstrap-sdu-cn,Alinear issue prep gate crosswalk en repo destino,BLOCKED_WITH_GATE_PACKET,si,"target files; issue template; protocol; authorization matrix",si,si,si,external repo write gate missing,5,REQUIRES_GITHUB_WRITE_GATE

