"thread","thread_id","return_status","classification","risk","recommendation","validator","stop_condition","mutations_executed","live_writes_executed","next_delta"
"HILO_A_CABINA_CANON","019ed742-6902-7302-befd-ae3391b9117c","RETURN_COMPLETE","CANON_OR_CONTEXT","HIGH","Aceptar como cambio canon/context de bajo impacto operativo; opcional ajustar wording OpenAI como medio de ejecucion sin alterar autoridad.","NO_EJECUTADO por hilo; diff review completo","repo_diff_unclassified","false","false","delta_a_cabina_wording_or_close"
"HILO_B_SDU_CANON","019ed742-df30-7e62-92ba-dc03fef58065","RETURN_COMPLETE","CANON_OR_CONTEXT","HIGH","No requiere paquete canon dedicado; commit posterior opcional si owner quiere canonizar nota de contexto.","diff --stat: 1 file changed, 8 insertions","repo_diff_unclassified","false","false","delta_b_sdu_context_optional"
"HILO_C_RUNTIME_README_BATCH","019ed743-57ce-7871-b52a-23747d549449","RETURN_COMPLETE","low-risk README-only narrative updates","LOW","Cerrar como lote unico; no micro-paquetes necesarios.","read-only diff review completo","readme_diff_ambiguous","false","false","delta_c_readme_batch_close"
"HILO_D_SESHAT_SGIN_EVIDENCE","019ed743-944e-7092-a121-71da46ecc642","RETURN_COMPLETE","seshat evidence identity ambiguous; SGIN package evidence; cumplimiento README-only","MEDIUM","Leer contenido solo de piezas ambiguas de Seshat bajo autorizacion explicita; no escribir.","status/diff/stat + file-size inventory","evidence_identity_ambiguous","false","false","delta_d_seshat_ambiguous_content_read_only"
"HILO_E_CDF_SOLUCIONES","019ed743-1e41-7503-a8a0-9204cd148760","RETURN_COMPLETE","CANON_OR_CONTEXT_PLUS_EVIDENCE","HIGH","Overlap confirmado entre contexto y evidencia; separar contexto de evidencia en delta scoped antes de mutar.","read-only status/diff/stat + inventory","context_evidence_overlap","false","false","delta_e_cdf_split_context_evidence"
"HILO_F_CLOUD_DATAVERSE_READY","019ed743-c65f-7f83-b1e1-f0cd66eac91b","RETURN_COMPLETE","READ_ONLY_PREFLIGHT","LOW","Mantener carril en lectura y esperar habilitacion del control tower para cualquier task live.","smoke PASS + cloud-bridge PASS","context_drift","false","false","delta_f_cloud_prompt_ready_no_live_task"
