asset_id,asset_type,owner_agent,authority_level,surface,runner,tool,recipe,mapping,allowed_actions,blocked_actions,validator,evidence,rollback,stop_condition,status
runtime_env_contract,environment,anubis-gate,owner_gate,User ENV,PowerShell -NoProfile,Environment.SetEnvironmentVariable,delta-gobernado,CEO_ROOT/CODEX_START_ROOT single source,"set User ENV; remove config/profile shadow; request elevated removal for Machine shadow","System shadow; profile autostart; live writes; secrets","PowerShell -NoProfile env probe","env-before.json; config.toml backup","restore env-before.json and config.toml backup",machine_env_shadow_requires_elevation,BLOCKED_MACHINE_ENV
ceo_runtime_status_entrypoint,runner,thot-tecnico,local_owner,C:\CEO\tools\bin,cmd wrapper,ceo-runtime-status.cmd,configuracion-entorno-codex-ui,PATH command to tools/ceo-runtime-status.ps1,"read runtime status; print JSON/text","write repo; open live; read secrets","Get-Command ceo-runtime-status; ceo-runtime-status --json","C:\CEO\tools\bin\ceo-runtime-status.cmd","remove cmd and PATH entry",entrypoint_not_resolved,ACTIVE_CANON
runtime_snapshot_baseline,tool,sentinel-runtime,local_owner,PROJEC CDX runtime,python venv,runtime_versioning.cli save,runtime-versioning-snapshots,snapshot HEAD as v0.6.0-rc1 baseline,"create local snapshot; update VERSION_STATE","push; PR; tag remote; workflow_dispatch","ceo-runtime-status --json; sdu_sentinel.py scan","operativa/snapshots; VERSION_STATE.json","revert generated snapshot artifacts",snapshot_not_aligned_to_head,ACTIVE_LOCAL
metadata_validator,tool,maat-cumplimiento,required_validator,PROJEC CDX metadata,python venv,python -m tools.validate,delta-gobernado,metadata contract validation,"validate front matter and meta.json","schema mutation without test","python -m tools.validate","schema.json; index.json","revert invalid artifact",metadata_invalid,ACTIVE_CANON
sdu_boundary_check,tool,anubis-gate,gate_owner,local boundary,python venv,tools/sdu_sentinel.py, sdu-ejecutor-gates,local no-external drift scan,"scan; check; guard local decisions","live action without owner/gate","python tools/sdu_sentinel.py scan; python tools/sdu_sentinel.py check","operativa/SDU_RUNTIME_BOUNDARY_MATRIX.json","revert boundary drift",sentinel_block_or_secret_risk,ACTIVE_CANON
sdu_chain_boot,tool,thot-tecnico,local_owner,system nervous chain,PowerShell/Python,tools/sdu_boot.ps1 + tools/sdu_chain_resolver.py,projec-cdx-semantic-layer,entrada->estado->orden->agentes->semantica->motor->modelo->evidencia->salida,"dry-run; no-external chain verification","external live; env.local read","sdu_boot -NoExternal -DryRun; sdu_chain_resolver --no-external --dry-run","MAPA_CAPAS.md; CURRENT.md; NEXT.md","revert chain artifact edits",chain_resolver_fail,ACTIVE_CANON
ahead35_strategy,decision,horus-riesgo,owner_gate,Git remote divergence,git,git rev-list/status,remote-publication-plan,local-only or PR governed strategy,"measure ahead; prepare strategy","push; PR open; tag; workflow_dispatch","git status --short --branch; git rev-list --count origin/main..HEAD","git log; remote publication gates","no repo mutation",owner_decision_missing_for_remote,PREPARED_NO_LIVE
runtime_closeout_readback,evidence,narrador-normativo,closeout_owner,operativa,Markdown,readback,governed-readback-closeout,final evidence and next action,"write local readback; report risks","claim without fresh validation","metadata; sentinel; runtime status; git status","operativa/tasks/20260623/CEO_RUNTIME_ENV_CONTRACT_20260623.md","revert readback",validator_failed,ACTIVE_LOCAL
eatomic_existing_agent,agent,EATOMIC,existing_operator,local runtime,governed tools,no new tool,no new recipe,existing operational agent only,"reference existing role","create duplicate agent by inference","sdu_chain_resolver agent inventory","inventarios/AGENTES_SKILLS_RECETAS_20260616.md","remove duplicate references",duplicate_agent_created,REFERENCE_ONLY
